#,Type,Name,Subtitle,Tier,Genre,Base,Flavor Text,Mecha Slot Passive,Size,Charges,Passive,Active,Ultimate
335,Armor,Black School Uniform,,2,Slice of Life,Armor Threshold 4,"For some reason, deliquents always have darker school unniforms. Huh.",,,,Equiptment Closet - Your Genre slot can hold a Sports Item,"Nail-Studded Bat - Free Action, 2PP - Your next Melee attack gains TR1 and Wound 3","Yurusanai - Reaction - When you would be reduced to 0 hp or below, gain Fury and Competitive until the end of your next turn and "
336,Armor,Maid Uniform,,2,Slice of Life,Armor Threshold 4,"What's not to love about a maid uniform? They come in so many types! There's the Classic, the Victorian, the French, the kind with a miniskirt, or a swimsuit, or the Chinese or Japanese styled ones, or the genre-crossing ones like Steampunk, Cyber, and Military maid uniforms!",,,,Hard Work - Add an automatic success to all Skill Checks,"Chance Meeting - Action, 2PP - When a non-hostile NPC is introduced for the first time, they happen to be an old acquaintance of yours.","I Saw It - Free Action - Were you out shopping and walked by? Doing some light cleaning and happened to gaze out the window? If an event happens, and it's plausible that you were there, you can declare that you were indeed present. The GM should let you know any information that you'd get from being there. If the GM rules that you wweren't there, the armor does not get depleted."
341,Armor,School Uniform,,1,Slice of Life,Armor Threshold 3,A standard school uniform that could be found in any school,,,,Student - +1 Know,"Smarts - 1PP, Free Action - Gain 2 Successes when making a skill check that involves Know, or 1 Success if it involves Imag",Late Day - Automatically Succeed a skill check or a save
342,Armor,Mights of the Mlood Platemail,,1,Action,Armor Threshold 3,The white and red armor of the Mights of the Mlood,,,,Floor Clearer - Gain 1 PP when you end combat that had an enemy with Boss Resists,"Respected - 1PP, Free Action - Gain 2 Successes when making a skill check with an NPC",Beacon of Hope - All party members regain your End HP
343,Armor,Magical Fuwa Fuwa Dress,,4,Subversion,Armor Threshold 6,"It's fluffy, pastel, and magical. Nothing better to wear for some wholesome brutal magical overkill of cartoony enemies. It'll be all smiles and giggles.",,,,"Magical Essence - Instead of using PP, you may instead take Wound equal to the amound of PP you substitute",Magical Overkill - 4PP - add 8d6  and TR1 to your next roll. Gain Unstoppable until the end of your next turn.,Magical Finale - Bonus Action - Your next attack's range is Melee Radius 20
344,Armor,Cursed Eyes of Chaos,May Confusion Spread,4,Horror,Armor Threshold 6,I SEE YOU I SEE YOU I SEE YOU I SEE YOU UNRAVEL UNRAVEL UNRAVEL,,,,Cursed Mark - Ranged effects with range 7 or greater can instead be Line-of-Sight,"Cursed Eye - Action, 4PP - Line-of-Sight, inflict Madness and Malfunctioning until the end of the target's next turn. ","Eyebite - Action - Inflict Madness Malfunctioning, and Fear on all targets of your choice in Line-of-Sight"
345,Armor,Mantle of the Supreme Beings,Grandmaster of the Great Tomb,5,Horror,Armor Threshold 7,It's said that the supreme beings have never faced defeat. Spread the name and might of the 41.,,,,"Might of 41 - The first time you equip each item in combat, it takes a free action instead of a bonus action. Your Genre Slot may hold any item type.","Super-Tier Magic - Free Action, 5PP - Gain one of the following effects. 
When using a damage-dealing power, add 10d6. 
When using a Threshold-Modifying power, increase that change by 3.","The Goal of all Life is Death - Action. In ten rounds; Radius 10, 100d6, Know or Imag Damage. This item is not depleted until the Ultimate triggers."
346,Armor,Santa Costume,,2,Romance,Armor Threshold 4,"A holiday classic, the Santa Outfit can be found in numerous variations, some having more coverage than others",,,,Warm Red and White - You don't suffer any side-effects of cold weather,"Give a Little Gift  - Bonus Action, 2PP - Range 3, heal 5HP or restore 2PP to the target",X-Mas Day Delivery - Action - All agents gain an item of their choice from the Gear Kit item list
351,Armor,Traveler's Riding Wear,,4,Slice of Life,Armor Threshold 6,"Rugged leathers, durable denims, and sturdy boots make up this fine set of road-ready apparel",,,,"Well Traveled - You are immune to Stunned, Slowed, Snared, and Grappled, and gain TR1 on Survival rolls","Traveler's Blessing - Free Action, 4PP - When travelling to a destination, you can chart a route that's either Faster than expected or Perfectly Safe, and you will not be attacked along the way",Uncanny Speed - Action - You plot a course to a landmark that you know of. It takes one day to reach this destination by this route.
352,Armor,Wasterlander's Leathers,,2,Action,Armor Threshold 4,Scavenged bits and bobs on top of sturdy travel gear,,,3,"Fully Covered - +1 Survival, TR1 on checks to conceal your identity","Survivalist - Free Action, 1PP - add 4d6 to a Survival check",Scavenged Armor - Reaction - This item has 3 charges. You may consume a charge instead of depleting this item. Charges reset on a rest. Gain DR 4 on an attack
353,Armor,Black-Tie Formal Attire,,3,Romance,Armor Threshold 5,"Nothing looks nicer than a well-tailored suit or a perfectly-cut dress. At the very least, it means that you mean business.",,,,Simply Striking - Appeal rolls gain TR2,"Slip of the Tongue - Free Action, 3PP - While talking to someone, they let slip some juicy gossip or classified information that they shouldn't have","Partied too Hard - You and your party black out, waking up in a random location with the benefit of Resting, and your GM adds a cost and a benefit, which can include the below:
Benefits: You gained an unlikely ally, You gain an Item that you didn't have, You wake up where you wanted to be
Costs: You lose an item of a lower tier than this item, You all lose half of your Gold, ISEKAI HQ is angered by something you did"
354,Armor,Swimsuit,,2,Romance,Armor Threshold 4,Swimsuits and anime go back almost as long as anime's been around. They come in a wide variety of styles.,,,,Aquatic Prowess - Treat being underwater as if you were on dry land and gain a Fly speed equal to double your Speed,"Nose Bleed - Free Action, 2PP - Inflict Slow and Wound 1 on a target as long as they're in Line-of-Sight",Slip Up - Bonus Action - Inflict Blind on all targets in Line-of-Sight until the end of their turns
355,Armor,Trenchcoat,,4,Thriller,Armor Threshold 6,"This doesn't need any flavor text, your actions will speak for it.",,,,Private Eye - All of your Search rolls are Maximized,"Stalk - Bonus Action, 4PP - When you're following someone, there's no chance for them to detect you, no rolls needed.","Supreme Sneak - Action - For the next hour, you are only detected if you want to be. Otherwise, you cannot be noticed"
356,Armor,Ahegao Hoodie,,1,Romance,Armor Threshold 3,...It's an acquired taste?,,,,Socially Innapropriate - Appeal rolls gain TI2,"Close-Up Details - Free Action, 1PP - Melee Radius 1, Inflict Blind and Fear","Realization - Reaction - When hit by a melee attack, inflict Backfire, Madness, and Fear on the attacker before they roll damage"
361,Armor,Way of the Void,,3,Sports,Armor Threshold 5,Close your eyes. Feel the darkness inside yourself. Make your enemies feel it.,,,,Toxic Body - You are immune to Blind and Backfire,"Whip Strike - Action, 3PP - Melee 3 Attack, TR2, Inflict Snared and Fear","Vaccuum Palm - Bonus Action - Until the end of your turn, your attacks permanently reduce your target's Threshold by 1"
362,Armor,Kakuka,,2,Horror,Armor Threshold 4,"""No cost is too great. If I need to sacrifice my humanity, then that's a only a small cost.""",,,,"Flesh Cost - When you are attacked, take 2 bonus damage","Corpse Collector - Bonus Action, 2PP -  Until the end of your next turn, take Inst damage at the end of your turn and increase your speed by Inst","Overdrive - Until the end of your next turn, gain Competitive"
363,Armor,Skyrigger's Harness,,2,Thriller,Armor Threshold 4,"""It's not the height I'm scared of, but the fall."" This canvas harness is covered in clips, rope, and pulleys, meant to clip onto the lifeline of a ship.",,,,Extra Pockets - You may equip an Accessory in your Weapon or Genre slot,"Retention Clip - Reaction, 2PP - When you are forcefully moved, you may return to the location you previously occupied",Buddy System - Free Action - You count as being Grappled by a target within 60ft
364,Armor,Over-Shoulder Captain's Regalia,,2,Action,Armor Threshold 4,"This over-sized jacket is perfect for wearing over one's shoulders, and the epaulets and tassles will keep you looking like the one in charge. Yes, there's sleeves, but that's beside the point!",,,,Commander's Stand - You cannot be moved by forced movement,"What’re Your Orders? - Bonus Action, 2PP - Allies within Know spaces add your Inst to all rolls for a turn","Down with the Ship - Reaction - When you die, all allies regain your Inst or Know d6 HP"
365,Armor,Kinetic Ballistics Plate,,2,Mecha,Armor Threshold 4,This plate carrier carries ceramic plates that disperse energy when they break,,,3,"Replacable Ballistic Plates - This armor contains 3 charges. When attacked, you may spend a charge as a free action to gain DR 4 for the attack","Replace Plates - Bonus Action, 2PP - Regain a charge on Replacable Ballistic Plates. You cannot go above 3 charges.",Down But Not Out - Spend all your charges. You cannot die for as many charges as you spent 
366,Armor,B.U.R.N. Coveralls,,1,Thriller,Armor Threshold 5,"They don't want to watch a show.
They want to watch a show burn.",,,,Volatile Fuel Tanks - Your Ranged attacks instead become Cone attacks of the same range. Attack rolls of 1 against you count as successes.,"Heat-Resistant - Free Action, 1PP - When targeted by area effects (Anything other than Ranged, Line-of-Sight, Melee), increase armor Threshold by 2",Show-Ending Napalm - Free Action - Your next Cone attack inflicts Wound 5
411,Armor,Projection Plating,,3,Mecha,Armor Threshold 5,"""Ok ok so, you know how mechas are always throwing up those light barriers to block bullets and missiles and stuff? Well, what if we could put that on a person?"" - Unknown scientist about to get a promotion",,,,"Deflect//Refract//Repulse Projectors - Whenever you you cause a Line, Cone, or Area effect, you may instead choose a range of Radius 3","Quick-Project Dome - Reaction, 3PP - Whenever you're target by an effect originating 4 or more spaces away, gain DR End. Whenever a Line or Ranged effect would be drawn within 3 spaces of you, grant the triggering effect TI 2.","Shimmer Shield - Bonus Action - You throw down a Radius 3 dome that is impervious to damage for 3 rounds. The dome projects the image of its surroundings on it; characters inside the dome are Invisible to characters outside the dome. Characters can move outside the dome, but none can enter the dome without teleporting."
412,Armor,Sky-Raider Exo-Suit,,1,Mecha,Armor Threshold 3,A powered exo-suit that screws into the skeleton. Only the truly desperate would turn to this.,,,,Bone Screws - This armor can only be un-equipped if it is depleted.,"Desperation - Reaction, 1PP - Whenever you take damage, gain TR 2 and malfunctioning for the rest of the round.",Burst of Clarity - Bonus Action - Increase your move speed and threshold by 2 for one round
413,Melee Weapon,Argalian Lance,,1,Action,Str/Agi,"""Wait, but we don't have mounted rules in ISEKAI.""
""Nah, don't worry about it. Just give them the move speed of their mount.""
""But have you seen any horses around here?""",,,,Cumbersome Lance - If you're not mounted or your Str is less than 3: Threshold Increase 1,"Jouster's Prize - Action, 1PP - Attack, Wound 1, Slow","Well-Placed Hit - Action - Attack, add 5d6, against mounted foes: TR 2"
414,Melee 2 Weapon,Kokorotawari,Oddity Killer,2,Horror,Str/Know,"This unnaturally long odachi has a vaunted history of slaying Yokai, and is perfectly weighted, handling especially well when about to go in for the kill",,,,"Abberation Slayer - When fighting Horror creatures, you may reroll any damage dice once with this weapon","Sever Oddity - Action, 2PP - Attack, Wound 5","Heart Span - Action - Attack, Melee Radius 3, add 5d6, kills decapitate enemies"
415,Melee Weapon,Gáe Buidhe,Mortal's End: Crimson Reverie,3,Action,Inst/Str,"The cursed yellow spear inflicts wounds that may never heal, and those wounds still weep to this day",,,,"Eternal Cuts - When this weapon Wounds, reduce the target's maximum hitpoints by the amount of Wound damage dealt","Critical Cut - Action, 3PP - Attack, add 3d6, Wound 3","Return to Dust - Action - Attack, add 15d6, All damage dealt is instead applied as Wound"
416,Melee Weapon,Gáe Bolg,Barbed Red Javelin,4,Horror,Inst/Str,"The cursed red spear is said to never miss its target. It's covered in small barbs and throns that expand on contact with blood, a gristly affair",,,,Beastly Ferocity - Weapon powers and attacks gain Threshold Reduction 2,"Barbed Throw - Action, 4PP - Ranged 12 Attack, add 4d6, Wound 20","Causality-Reversing Throw - Action - Line-of-Sight Attack, add 8d6, TR 10, damage is also dealt as Wound for an equal amount"
421,Melee Weapon,Bottomless Bucket of Blades,Unlimited Budget Works,5,Art,Inst/Str,"The sheer costs of keeping a never-ending supply of blades stocked is enough to pay for, say, a vast IP with countless games, visual novels, shows, and movies!",,,6,"Nameless Blade - This item starts combat with 0 charges. You may spend a charge to add Damage Multiplier +3 to an attack. Your rolls gain TR1 for every Sword within Melee Radius 1. As a bonus action, you can spend 6 charges to override the battlefield with a neverending and uninteresting flat plane devoid of walls and terrain.","Distribution of Blades - Action, 5PP - Set your number of Charges to 6 and place a Sword in 6 unoccupied spaces within Melee Radius 3. If you've overridden the battlefield with Nameless Blade, place another 6 Swords within Melee Radius 6. Swords block Line of sight but not movement. ","Unstable Blades - Action - Make an attack, additionally targeting all characters within Melee Radius 1 of all Swords. Destroy every Sword you've placed, gaining Damage Multiplier +1 for every Sword destroyed. Afterwards, you become Downed at 0HP"
422,Melee Weapon,Occam's Razor,Keep it Simple,5,Thriller,Str/Agi,A narrative principle manifested into a powerful narrative-trimming tool,,,,"Extranarrative Extrusion - This weapon does not attack things directly, but iinstead damage their canonity. The GM may interpret that as they wish.","Keep it Simple - Free Action, 5PP - If the rest of the party agrees that a narrative is too complex, for example a character's motivation, the history of a place, an elaborate ruse, and you agree on a replacement that would be much simpler, that now becomes the canon",Simplicity - Free Action - Use Keep it Simple at no PP Cost
423,Melee Weapon,Excalibur,Paragon of Blades,5,Action,Str/Know,"In any category of things, there will always be a best and a worst. In terms of weapons, there is no competition, Excalibur stands at the top.",,,,"Holy Paragon - This sword is a symbol of divine authority, all appeal checks made by you have TR 4","Divine Construct - Action, 5PP - Line 10 Attack, add 5d6, TR 2","Sword of Promised Victory - Action - Line 20, add 13d6, TR 2"
424,Range 10 Weapon,Prelati's Spellbook,Text of the Sunken Spiral Castle,3,Horror,Know/Imag,"The book, bound in human flesh, contains the rantings and ravings of one who spent their life in madness. What can you gleam from its contents?",,,,Eldritch Bolt - Gain the Horror tag while using this weapon. You can choose which ability to use when affected by Madness.,"Twist Mind - Action, 3PP - Ranged 10 Attack, inflict Sickness or Madness, add 6d6","Eldritch Word - Action - Line-of-sight, Ranged Radius 3, inflict Slow and Madness, Permanent TR 3"
425,Melee Weapon,Sword of the Four Heroes,,2,Action,Str/Know,"The weapon of a distant land's hero, it's designed to shift and grow alongside them.",,,,"Cardinal Weapon - You may destroy another weapon in your inventory, replacing this item's Passive, Active, or Ultimate with the corresponding one of the destroyed item. ","Meteor Slash - Action, 2PP - Melee 2, up to 3 targets in range, add 4d6","Sword of Greed - Reaction - After you use a power to deal damage, you may triple the damage instead. The round after this is used, all of your powers and attacks miss"
426,Melee Weapon,Spear of the Four Heroes,,2,Action,Inst/Str,"The weapon of a distant land's hero, it's designed to shift and grow alongside them.",,,,"Cardinal Weapon - You may destroy another weapon in your inventory, replacing this item's Passive, Active, or Ultimate with the corresponding one of the destroyed item. ","Meteor Thrust - Action, 2PP - Melee 2, up to 3 targets in range, add 4d6","Spear of Lust - Reaction - Upon rolling a skill check, you may either roll Appeal instead of the skill required or double your Appeal for the check"
431,Range 12 Weapon,Bow of the Four Heroes,,2,Action,Agi/Know,"The weapon of a distant land's hero, it's designed to shift and grow alongside them.",,,,"Cardinal Weapon - You may destroy another weapon in your inventory, replacing this item's Passive, Active, or Ultimate with the corresponding one of the destroyed item. ","Meteor Shot - Action, 2PP - Ranged 24, up to 3 targets in range, add 2d6","Bow of Pride - Reaction - After rolling against a threshold, you may gain TR 2 and attempt the roll again and add 5d6"
432,Range 12 Weapon,Blooming Bow of Hope,,4,Art,Agi/Imag,"The bow looks like it's made of living wood. It's said that every time one of its flower buds bloom, someone finds salvation.",,,,"You Aren't Alone - As long as there's an allied character in Melee Radius 3, you and allies within this area gain Fury","Budding Arrows - Action, 4PP - Attack, add 8d6, this attack doesn't require you to see the target, as long as a valid path can be traced without traveling more than the weapon's range",Salvation's Sigil - Action - Range 3 Ranged Radius 20 Attack
433,Melee Weapon,Mermaid's Sabre of Despair,,3,Thriller,End/Agi,"""The Mermaid took her sword, carving into the scales and flesh until she had made a pair of glistening legs. Rejoicing through the pain, she pulled herself above the waves, leaving a crimson trail as she went.""",,,,"Symphonic Healing - At the end of your turn, if you're below half health restore End HP","Twin Blades - Action, 3PP - Attack, add 6d6, TR 1","Stupid, so Stupid - Action - Melee Radius 6 attack, TR 1, inflicts Backfire on the user, add 15d6"
434,Range 10 Weapon,Ribboned Muskets,,2,Action,Know/Imag,"Tight yellow ribbons wrap around the exterior of these flintlock muskets. When the weapon fires, they spring to life.",,,,"Delicate Gunplay - After making a ranged attack with this weapon, you can inflict 2 damage on a target in melee range","Tie Down - Action, 2PP - Attack, add 4d6, inflict Snared","Final Shot - Action - Attack, Ranged Radius 3, add 15d6, inflict Grappled"
435,Melee 3 Weapon,Red Chain-Spear,,3,Action,Inst/Str,"Chain-Spears combine the reach of a spear with the fluidity of a whip. they're hard weapons to master, but rewarding",,,,Segmented Chain - You can Grapple targets within this weapon's range,"Chain Slash - Action, 3PP - Melee 5 attack, you may attack up to two targets within range",Latticework Barrier - Bonus Action - Choose 5 connecting free spaces within range 5. These spaces become a wall that lasts 3 rounds. Hostile attacks cannot pass thorugh this wall
436,Melee Weapon,Weitz-Schweizerdeane,,1,Action,Str/Agi,"A simple blade between the lengths of a dagger and a shortsword, made of a dull steel",,,,"Baselard - This weapon is easily concealable, increasing Thresholds to find it by 1","Slash - Action, 1PP - Melee, add 2d6","Sliding Slash - Action - Melee 2, add 5d6, 2 Damage, Move 3, you can slide through an enemy's space"
441,Melee Weapon,Dagger of the Hearth,,2,Thriller,Str/Agi,"This black dagger gives off a constant, reassuring warmth, as if it's looking out for you",,,,"Hearth's Blessing - This dagger grows with you, weapon powers deal damage equal to one-half of your level, rounding down (min. 1)","Firebolt - Action, 2PP - Ranged Line-of-Sight, Agi/Imag, add 4d6","Sacred Flame - Free Action - If the wielder is Downed, the flame of the hearth automatically ressurects them to full HP"
442,Range 10 Weapon,P90-Chan,,2,Action,Inst/Agi,This pink submachine gun is here to be your bestest friend! It craves violence.,,,,Point Blank - If attacking a target within 2 spaces: add 2d6,"Sliding Shot - Action, 2PP - Ranged 2 Attack, add 4d6, Move 3, you can slide through an enemy's space, and this movement doesn't provoke reactions from the target of this attack",Body Block - Reaction - Reduce damage dealt to you by an attack to 0
443,Melee Weapon,Goblins' Bane,,1,Action,Str/Know,This sword's old wielder imprinted one irrefutable aspect of themselves upon this weapon. All. Goblins. Must. Die.,,,,Goblinbane - When fighting Goblins: gain TR 1,"Burning Oil Flask - Action, 1PP - Ranged 6, Ranged Radius 2 attack","Goblin Slayer - Action - Attack, add 5d6, against Goblins: TR 2, 2 Damage"
444,Melee Weapon,Pen of Divine Creation,,4,Art,Know/Imag,"These Pens are made in the image of those that create these worlds. It is not as potent as the original, but even replicas can have some powers of their own...",,,8,Rewrite - 1/Round as a Free Action change the genre of a target in Range 3. This item regains all charges on a Rest,"Sketch - Bonus Action, 4PP - Consume a charge and create one of the following. These look however you want them to, and act as you would expect them to:
Objects - You fill up to three free spaces next to you with a large object or multiple smaller objects. They can provide cover, granting TI 2 on attacks that originate on the opposite side that you're on, or it can completely block Line-of-sight. Each object has a Threshold of 3 and each space has 5 HP.
Character - A character appearns in a free space next to you. Their stats are all 1, have 5 HP and a Threshold of 1. They are considered allied to you.",Inkwell - Free Action - This item regains all spent charges. This item discharges after a minute passes.
445,Melee Weapon,Edged Soulblade,,4,Horror,Str/Know,There are some entities that prey on the vices of others. What are you willing to sacrifice in order to succeed?,,,,"Malevolent Will - Attacks with this weapon inflict Wound 5. Every time your attack hits, you take 1 damage. This weapon is a Sentient and Evil creature that takes over the users body if they die","Consumption - Action, 0PP - Attack, add 10d6, inflict Wound 10. The user's End is reduced by 1. When you rest, you restore half of the End reduced this way, rounding down","Devourer of Souls - Action - Attack, inflicts Backfire on the user. If the target has a soul: 100 Damage and the soul is consumed. If this kills you as well, then the attack cannot be Boss Resisted"
446,Melee Weapon,Assassin's Concealed Blade,,1,Thriller,Know/Agi,"In the darkness, a glint of light, a silent strike. By the time they notice, they're already dead",,,,"Concealed Blade - This weapon is easily concealable, increasing Thresholds to find it by 1","Assassinate - Action, 1PP - Against an unsuspecting target: Attack, TR 1, add 2d6","Be Casual - Action - Attack. Against unsuspecting targets: Melee Radius 1, TR 2, add 2d6"
451,Range 3 Weapon,Gratata,,3,Action,Inst/Str,"This bulky alien rifle fires at absurd rates of fire, and comes with a twin for added mayhem.",,,,"Bullet Hose - Weapon powers and attacks gain Threshold Increase 2, but double attack dice","Akimbo Attack - Action, 3PP - Attack, TI1, double attack dice","Gratata Spray - Action - Attack, Quadruple attack dice"
452,Melee Weapon,Ruby Scythe,,3,Action,Str/Agi,This large scythe can be quickly folded into a gun. Or is it a gun that can be unfloded into a scythe? Who made this thing?,,,,"Dual Frame - You can equip a Ranged weapon in your genre slot. If equipped this way, the sum cost of both weapons is set to the highest value of either weapon, and you may treat the both weapons as a single combined weapon.","Bladed Stabilization - Action, 3PP - Melee 2 Attack, add 6d6, the next Ranged attack you make with this weapon next turn has TR 3","Rose Flourish - Action - Melee Radius 2 Attack, add 15d6, Move 3 spaces ignoring reactions"
453,Melee Weapon,Tyrant Spear,,4,Action,Inst/Str,The Tyrants once wandered the plains until hunted to extinction. The claw of one of these apex predators is sharper than any steel blade.,,,,"Tyrant Claw - Your armor active powers cost 2 fewer PP, to a minimum of 1","Ring of Flame - Action, 4PP - Melee Radius 2 Attack, add 4d6, TR 2","Tyrant Bite - Action - Line 2 Attack, add 20d6, inflict Slow, TR 4"
454,Melee Weapon,Naughty Dragon,,2,Romance,Str/Agi,It looks like it fell off of a Horror creature,,,,Socially Innapropriate - Appeal rolls gain TI 2,"Silicon Slap - Action, 2PP - Melee, add 4d6, Wound 2","Vanishing Trick - Action - Melee Attack, add 10d6, Deal 1 Wound for every character within Melee Radius 5 of the target"
455,Melee Line 2 Weapon,Slayer's Slab,,4,Action,Inst/Str,"Some schools of thought believe that if you make a sword big and heavy enough, then it won't need to worry about sharpening it or having your attacks blocked. They aren't wrong.",,,,"Absurd Size - attacks gain TR 1, when fighting Horror creatures: you may reroll any damage dice with this weapon","Sheer Momentum - Action, 4PP - Melee Radius 2, add 8d6, TR 1","Impossible Cleave - Action - Attack, double attack dice, add 10d6"
