#,Type,Name,Subtitle,Tier,Genre,Base,Flavor Text,Mecha Slot Passive,Size,Charges,Passive,Active,Ultimate
225,Accessory,Shin Guards,,2,Sports,DR 2,"Lower body protection is often overlooked, but you'll be thankful you're wearing these next time you bump your shin on a piece of furniture",,,,"Padded Protector - Your speed cannot be reduced, Immunity to Slow and Snared","Powerful Kick - Free Action, 2PP - When you make a Ranged X attack, it instead becomes a Line X attack","Juggernaut - Bonus Action - Until the end of your next turn, gain Unstoppable and Fury"
226,Accessory,Splendid Bouquet,,3,Romance,Imag +2,"This colorful assortment of flowers, each on its own masterpiece, blends together perfectly well to make a bouquet of impossible beauty",,,,Impossible Beauty - Appeal checks gain TR2,"Bishie Sparkles - Free Action, 3PP - When you would roll Moxie or Rage, you can instead roll Appeal",Flower Power - Bonus Action - Maximize an Appeal roll
231,Accessory,Scented Shampoo,,2,Romance,Imag +1,"Keeps the grease out of your hair, and smells nice to boot!",,,,"Alluring Scent - Appeal checks on targets in Melee Radius 2 have TR1, and anyone in this zone who attacks you must first roll a d6. On a 3 or below, the attack is minimized","Nosebleed - Action, 2PP - Ranged Line-of-Sight, Inflict Wound 1 on target for every character in melee radius X from the target, where X is the target's Imag",Bottled Bliss - Action - Your next roll gains TR3
232,Accessory,Iconic Hat,,4,Art,Imag +3,"""Wait... that Hat, I've seen it before! That means... No, it can't possibly be! It can only be that person...""",,,,"Iconic - This item contains the Iconic power and the effect of one power of your choice from Iconic Look. These can be swapped during a rest. This item's Active power becomes the effect from Iconic. Any modifiers that would be applied to the Iconic power apply to Don't Wear It Out instead, although the PP cost remains the same","Don't Wear It Out - X Action, 4PP - Use this item's Iconic Power","All Out - Action - Use Don't Wear It Out, gaining the effects of 3 more Iconic Look powers"
233,Accessory,Daruma Doll,,1,Horror,End +1,"This red doll is weighted to right itself when pushed. Its large white eys are blank, one being painted in when you set a goal, and the other being painted in when the goal is complete. In the meantime, it'll be there to give you good luck.",,,,"Wall-Gazer - After sitting motionless in place for a minute, you blend in with the environment, gaining TR4 on Stealth until you move.","Wobbly Doll - Free Action, 1PP - Negate a Stunned, Paralyzed, Snared, or Grappled effect on you","Misfortune Ward - Reaction - When you would fail a save, you instead succeed"
234,Accessory,Woodchipper,,2,Horror,End +1,"With peeling paint, what's not to love about this blood-splattered metal contraption of death. The dents, scratches, and handprints illustrate its highly-trafficked past, and any potential owners should know that this is a reliable piece of machinery! It'll run regardless of what you throw in it!",,,,"Stationary - The Woodchipper inhabits a space. It is not affected by attacks and cannot be destroyed. All characters can move through this space. Any allied character can target a character that's inside or Grappled while adjacent to the space the Woodchipper inhabits as if they're in range of the targeting effect, and attacks made this way can be treated as a Bonus Action, and gain the Wound 4 effect.","Place Woodchipper - Bonus Action, 2PP - Choose an empty space adjacent to you. The Woodchipper now inhabits this space. If the Woodchipper was already placed, it teleports to the new space.","Fleshgrinder - Action - Cone 3, add 5d6, Wound 4, Hit targets are sucked into the same space as the Cone's origin, and then ejected 1d6 spaces in the opposite direction of the Cone."
235,Accessory,The Monkey Paw,,5,Horror,DR [remaining charges],"""A terrible thing, to wish upon the monkey paw""",,,5,"Blood Binding - This item can only be unequipped during a Rest or while the item is Depleted. While Equipped, your Armor Threshold equals the number of remaining Charges. The GM can choose to inflict Backfire on one of your rolls to restore one of this item's charges","Pyrric Wish - Free Action, 5 PP - Consume a charge, +25d6 or +25 Gold","Schadenfreude - Bonus Action - +25d6, TR3, for every even roll result take 1 irreducible damage"
236,Accessory,The Black Crown,,3,Horror,"Know +1
Inst +1","The Black Crown sits atop the Brow of the Prince-Of-All-Evils and it Plots, Plots Abhorrent-Deeds",,,7,"The Price of Penance - Your attacks inflict Wound 1, or if they already inflict Wound, that value increases by 1. Any time you're hit, you gain Wound 1","Enactor of the Abhorrent-Deed - Bonuc Action, 1 Charge - Inflict Wound 5 on a target within 6 spaces. Your next roll gains TR 2","Sanguinity - Bonus Action - For the next three rounds, any time you kill a target while you are Wounded restores one of the Crown's spent charges"
241,Accessory,S-Tier Lotto Prize,,3,Slice of Life,Imag +2,"The golden ball, the lucky draw, the rarest gachapon. There's many ways to win, and you've just scratched the surface.",,,,"Extremify - Whenever you roll, you may choose to first roll a d6. If the result is odd your roll gains TR1, if even your roll gains TI1.","Extreme Luck - Bonus Action, 3PP - Roll a d6. 
If the result is odd: gain TR2 until your next turn 
If the result is even: choose a target in line-of-sight. Their rolls gain TI 2 until the end of their next turn.","Luxury Vacation R&R - Action - You recieve an all expenses paid vacation for a week. Have some narrative downtime, you've earned it! When you come back, everyone regains all of their PP, have TR 1 on all rolls for the rest of the day, and count as Experienced in all skills for the rest of the day. This ultimate can only be recharged after the vacation is complete."
242,Accessory,Quick-Draw Holster,,2,Thriller,Inst +1,"This holster sits flush to the body, with perfect ergonomics to be the first one to draw",,,,"Sure Shot - Whenever you make a Ranged attack, add 1d6","Quickdraw - Reaction, 2PP - Make an attack or use a power that makes an attack. You can't use this if you've already used your action, and if you use this before your action, you forfiet your action this round","Fastest Hand - Reaction - Move your initiative card to the top of the current card, and take your turn now."
243,Accessory,Irishman's Skeleton,,4,Sports,Agi +3,The perfect tool for the martial artist assassin. Always bring your best weapon to every fight.,,,,Hidden Razors - Melee attackers take Agi damage.,"Explosive Punch - Action, 4PP - Make a melee attack that gains Agi bonus successes.","Chest Bomb - Reaction - When you take damage, deal damage equal to Max HP + Know in Radius 3. This damage cannot reduce you below 1HP."
244,Accessory,Exodus,Five Cards of the Forbidden One,3,Sports,Inst +2,"The legendary Exodus was too powerful for this mortal realm, and so its form was split and bound within 5 trading cards. It's said that by collecting them all, a spiky-haired protagonist can unleash its true potential, within tournament rules.",,,,"Card Draw - Once per Round, as a Free Action, add a d6 to a roll. Set aside this dice, keeping track of the dice's result. These results are reset at the end of combat.","Mulligan - Free Action, 3PP - When you roll, you may also reroll any number of dice from Card Draw, adding them to the roll. Afterwards, set them aside again.","Unleash Exodus - Bonus Action - Increase an ability of your choise by 5. Distribute 5 points between your Threshold and Damage. These effects last until the end of combat. This Ultimate can only be used if the dice set aside from Card Draw contain 5 unique numbers. Instead of discharging this item when this Ultimate is used, reset the number of Card Draw dice to 0."
245,Accessory,The Lucky Whistle,,2,Sports,End +1,"""Coach, how'd you know we'd make it to nationals?""",,,,Daily Training - You and all allies gat TR1 on Athletics checks,"Hustle - Bonus Action, 2PP - Two targets within range 10 gain Fury until the end of their next turn",Buzzer Beater - Bonus Action - Two targets within range 10 may move up to their speed and attack
246,Accessory,Signed Jersey,Legacy,5,Sports,"Str +2, End +2","This jersey is full of the blood, sweat, and tears of the greatest athlete to ever live. Every victory, every defeat. Maybe you'll surpass their legacy.",,,,"In the Zone - You're always affected by Fury. Athletics checks recieve TR 2. This item can be worn in the Armor slot, granting Threshold 5","Power Through - Free Action, 5PP - Until the end of your next turn, gain Competitive, double your Speed, and your movement does not trigger reactions","Historic Feat - Free Action - Your next roll is Maximized, add 15d6, and cannot be Boss Resisted"
251,Accessory,Catcher's Mitt,,3,Sports,End +2,"It looks like an innocent catcher's mitt, but the tag inside reads 'Product of ACME Co.'",,,,"Rebound - If an ally targets you with a ranged attack, they can remake the attack with you as the point of origin","Quickball - Free Action, 3PP - When an ally uses Rebound, add 6d6 and TR 2","Knuckleball - Free Action -  When an ally uses Rebound, add 15d6 and TR 3. Additionally, you may change the range to be one of the following: Cone 5, Line 10, Line-of-Sight ignoring cover"
252,Accessory,Long-fall Leg Augments,,1,Mecha,Speed +2,"With these external augmentations, you'll never be caught flat-footed",,,,"Exo-Legs - You don't take damage from falling, and are immune to Slow","Augmented Jump - Bonus Action, 1PP - Jump a number of spaces equal to half your speed","Freerun - Free Action - For the rest of combat, you are immune to Slow, Snared, and Grappled. When you would be Paralyzed, become Stunned instead."
253,Accessory,4D Pocket,,2,Mecha,Agi +1,"Store your items in the 4th Dimension! It's all in the name, really.",,,,Hammerspace - This item possesses infinite extradimensional storage with a maximum opening equal to your size class,"Artistically Elastic - Bonus Action, 2PP - The pocket opening stretches up to 3x your size class until you add an item into it. Removing large items from the pouch doesn't require the use of this power.",Partial Inversion - Bonus Action - Any number of items stored in the pocket instantly appear in the nearest available spaces. 
254,Accessory,The Prank Book,,5,Comedy,Imag +4,"This arcane tome has been passed down for generations, and contains within it every joke, gag, and gaff that will ever be performed by mankind.",,,,"All Jokes are Good - Your background becomes: If you make a joke, a bad joke, or break the fourth wall, gain 2 PP","It's Just a Prank - Reaction, 5PP - At the end of your turn, you may declare it was all a prank. Take your turn again, but this consumes that turn's reaction","The Oldest Trick - Action - You invoke the Oldest Trick in the Book. A target in Line-of-Sight is Feared for the next day. This fear cannot be removed. While Feared, the target will attempt to leave combat if applicable. If this is Boss Resisted, the item is not discharged."
255,Accessory,Nullification Sheathe,Counter-actor Panacea,2,Mecha,Know +1,"From the outside, it looks like a plain black sheath, albiet glossier than one might expect. The inside, however, contains a nullification field that reduces all paracausal effects.",,,,"Empty Sheath - This item can go into your Genre Slot. While this is equipped, you may designate another equipped item. That item's Passive effect is replaced with ""[Nullified]""","Anti-Draw - Action, 2PP - Melee, Str/Agi, 0 Damage, inflict Sabotage 5 on hit","Inverted Field - Free Action - If you have an item with the [Nullified] passive, revert it to its original state and double the passive effect for a minute"
256,Accessory,Teru Teru Bōzu,Tissue-Paper Monk,3,Slice of Life,Inst +2,"These charms look like little ghost dolls, and ward away the rainy days. If you hung enough of these up, would it ever rain?",,,,"Morbid Origins - This item genre tag can be Slice of Life, Horror, or Art. If your genre matches this item, gain TR1 on Appeal checks.","Forecast - Free Action, 3PP - You determine the weather for the next 24 hours, within what's reasonable for the region","100-Year Storm - Action - The rain begins to pour. In an hour, water builds up in a 1 space deep flood with narrative heavy winds."
261,Accessory,Lofi Beats Playlist,,2,Slice of Life,Inst +1,"ISEKAI Field Training warns against playing music during an active operation, citing lowered situational awareness and distraction during mission-critical messages. However, agents can regularly be found in the field with music going into one ear and orders in the other.",,,,"To Infiltrate/Operate To - From sunset until dawn, gain TR1 on all out-of combat rolls","Stay Cool - Free Action, 2PP - Your next roll gains TR1","Party Playlist - Bonus Action - Until the end of your next turn, you and all allied characters make rolls with TR1"
262,Accessory,Flexible Art Style,What are the artists on?,3,Art,X +2,"ISEKAI researchers still aren't sure if it's an art style, a targeted fault in reality, or the meddling of an otherworldly power, but one thing is for sure: It's better than a disguise holo.",,,,"Ever-Changing - You can change your appearance at will, but you must still look humanoid. When this item is unequipped, you revert back to your original appearance.","Exaggerated Form - Free Action, 3PP - Your physique changes, yielding one of the following effects - 
Secretly Muscled - This item grants +2 Inst, and you gain Experienced with Reflexes
Extremely Muscled - This item grants +2 Str, and you gain Experienced with Athletics
Inflated - This item grants +2 End, and you gain Experienced with Moxie
Perfectly Average - This item grants +2 Know, and you gain Experienced with Magic
Extremely Overdefined - This item grants +2 Agi, and you gain Experienced with Stealth
Chibi-like - This item grants +2 Imag, and you gain Experienced with Appeal
This power remains in effect until another one is chosen.","Monstrosity - For one minute, gain every possible effect from Exaggerated Form, and gain the Art and Horror genre tags. At the end of the minute, this item is discharged."
263,Accessory,Codex Esoterica,,3,Art,Experienced +1,"This large tome has a clean white cover that only says ""Esoterica"" is gold lettering. The sheer amount of information within it is almost incomprehensible, but the contents seem either mundane, trivial, or for scenarios so specific that they'd hardly ever happen.",,,,"Tome of the Obscure - If a skill roll does not clearly fit within one of the ISEKAI skills, and your GM says that it's a weird/obscure ability, You may roll a combination of Know or Imag and one other ability, treating yourself as Experienced for the roll.","Consult the Codex - Free Action, 3PP - When you use Tome of the Obscure, instead roll a combination of Know or Imag and two non-Know or Imag, and gain TR 2 for the check.",Precognition - Free Action - Tome of the Obscure applies to any single non-combat roll.
264,Accessory,Virtual Avatar,,1,Art,Imag +1,ISEKAI HQ took note of the rise of anime-adjacent Virtual Personalities and decided to do a limited-run implementation of alternate Adaption Holos.,,,,"Virtual Avatar - The appearance of your Adaption Holo changes to be that of a non-existant anime character. When you enter a new show, roll a d6. On a 6, this appearance coincidentally is lore-friendly to the show","Beloved Icon - Free Action, 1PP - When rolling for a social interaction, roll with TR1","Rabbit Hole - Action - For the next hour, your appearance changes to be that of a non-existant anime character. This also applies to any target of your choice within Melee Radius 3, although no two characters can look the same."
265,Armor,Plogsuit,,2,Mecha,Armor Threshold 4,"This tight-fitting bodysuit pushes any felt stimuli directly to the pilot through direct nerve interfacing, allowing for unparalleled organic control and feedback",,,,"Subjectivity Sync - While you have a Mecha equipped, increase Speed by 2, and equipped Mecha don't reduce your Max PP","Aggression Feedback - Bonus Action, 2PP - Until the end of your next turn, your Ranged/Melee attacks gain Ranged/Melee Radius 1","Nerve Burnout - Free Action - Your PP is set to 20, and until the end of your next turn, you get an extra action on your turn. At the end of your next turn, you drop to 0 HP. This cannot be prevented in any way."
266,Armor,Goblinbane Plate Armor,,1,Action,Armor Threshold 3,Worn and chipped half-plate armor. It's enough to protect you from a few hits,,,,"Hatred of Goblins - The PP cost of Goblinbane items is reduced by 1, Against Goblins: Threshold 5","Simple but Secure - Reaction, 1PP - When attacked, increase Threshold by 1",Mighty Evasion - Reaction - Reduce an attack's number of rolled dice by End
311,Armor,Dark Swordsman's Duster,,2,Action,Armor Threshold 4,"This black duster is a replica of the one worn by the legendary Dark Swordsman, known for their dual-wielding. While a copy, it still imparts some of their combat prowess",,,,Dual Wielding - You can equip a weapon in your genre slot,"Combat Healing - Bonus Action, 2PP - Restore End hitpoints",Heroic Dodge - Reaction - Reduce the weapon damage of an attack by Agi
312,Armor,Pyonkichi Plate Armor,,3,Action,Armor Threshold 5,"This lightweight half-plate armor is designed to keep the wearer mobile, but can still take a blow",,,,"Lightweight - Your Speed increases by 2 spaces, you can move through enemies' spaces","Evasion Reflex - Reaction, 3PP - Reduce an attack's number of rolled dice by Inst and then move up to your Speed. This movement does not provoke reactions.","Instinctual Defense - Bonus Action - Until the end of your next turn, increase Threshold by Inst"
313,Armor,Tyrant-Cursed Plate Armor,,4,Action,Armor Threshold 6,"""So this thing's made out of some sort of big Kaiju-like monster?""
""Yup, a Tyrant.""
""And you're saying that it isn't dead?""
""Yup, the armor's alive.""
""Is this... safe?""",,,,Tyrant Flesh - Your weapon active powers cost 2 less PP,"Parasitic Adaptation - Reaction, 4PP - When attacked, increase Threshold by 4 and resist a debuff. Roll End vs attacker Tier, if 1 or fewer successes: Permanent Armor Threshold Reduction 1","Salamander Hide - Bonus Action - Invisibility for Inst turns, while invisible: +8d6 to attacks"
314,Armor,Golden Godplate,,5,Art,Armor Threshold 7,"""Kneel before me.""
This armor glimmers with the radiance of the sun. No blemish marrs its surface. It is perfect, a masterpiece, a paragon. It demands excellence, and nothing less.",,,,"Golden Rule - When using a weapon power, you may change the range to Ranged 10, against attacks and powers of 3rd tier or lower: Threshold 10","Heaven's Gate - Action, 5PP - Roll once on the Item table. You now have this item, and the active cost is 1. It disappears at the end of the day or your next rest.",King of Kings - Action -  Roll 3 times on the Item table. Use the Ultimates of the rolled items instantly
315,Armor,3-Star Council Regalia,,3,Comedy,Armor Threshold 5,An extraordinary uniform wielded by the upper eschelon of characters from a certain show. They're specifically customized for the wearer,,,,"30% Plot Fiber - Increase a stat by 2 and another by 1, While wearing this, gain the Student Council Member power from Slice of Life","Upper Crust - Free Action, 3PP - The next roll you make gains two of the following effects:
Inflict Backfire and Malfunctioning until the end of the target's next turn
Inflict Wound 5 and Madness until the end of the target's next turn
Add 6d6
TR1",Plot Limit Break - Bonus Action - Maximize all rolls you make until the start of your next turn
316,Armor,Armor of Infinite Layers,,4,Comedy,Armor Threshold 6,"""Man, If I weren't wearing so many layers right now, that could have been dangerous!""
""Dude, I'm pretty sure she just cut off your arm.""
""That's what I mean! That could have really hurt if I wasn't wearing so many layers!""",,,9,"Many Layers - When you are hit by an attack targeting only you, as a reaction you can spend a charge to make the attack miss you instead. However, on your next turn, you cannot only use your action and either your bonus action or move action.","More Layers - Bonus Action, 4PP - This item regains a charge. You may use this once for free when you take a rest.","Unavoidable Goodbye - Free Action - Your next attack gains Backfire, Radius 2, +20d6"
321,Armor,2-Star Fight Club Regaila,,2,Comedy,Armor Threshold 4,"This special uniform has a higher concentration of special fibers, increasing the wearer's overall performance",,,,20% Plot Fiber - Increase two stats by 1,"Fighting Spirit - Bonus Action, 2PP - Gain Fury until the end of your next turn",Superior Reflexts - Reaction - Add or Subtract 5 dice from a roll
322,Armor,1-Star Fighting Uniform,,1,Comedy,Armor Threshold 3,"This simple uniform is infused with special fibers that form a symbiotic relationship with the wearer, slightly boosting the wearer's physical attributes",,,,10% Plot Fiber - Increase a stat by 1,"Power Up - Bonus Action, 1PP - Gain Fury until the end of your turn",Heightened Reflexes - Reaction - Add or Subtract 2 dice from a roll
323,Armor,Kotatsu,,2,Slice of Life,Armor Threshold 4,"The Kotatsu, an infamous trap that seduces agents with warmth and comfort. Once an agent goes in, they often never want to leave, instead taking the heated table with them.",,,,"Stationary Warmth - You are permanently Slowed, you are immune to Ranged, Line-of-Sight, and Paralyzed effects while Slowed.","Radiating Aura - Action, 2PP - Melee Radius 1, inflict Snared and Backfire","Mandarin Oranges - Action - Melee Radius 3, clear all debuffs"
324,Armor,Blood Armor of Fafnir,,4,Action,Armor Threshold 6,The Dragon had hardened scales that would repel the spears and swords that opposed it. The armor it wore must be tougher then even those hardened scales.,,,30,"Dragon's Defense - against attacks of 2nd tier or lower: Threshold 9, you count as a Dragon while wearing this","Plot Essence 30 - Free Action - This armor contains 30 charges. Instead of using PP, you may spend up to 4 charges and restore the same amount of PP to yourself","Evil Dragon's Wrath - Cone X, add Xd6, where X is the remaining amount of charges"
325,Armor,Forlorn Mermaid Plate,Between the Waves and Sand,3,Thriller,Armor Threshold 5,"""And so the Mermaid wept, for she was no longer welcome in her world, and nothing remained for her upon the land.""",,,20,"Mermaid Tears - If your HP drops below 0, roll 1d6. If the dice roll is less than your End, you go to 1 HP. Until you rest, reduce your End by 1","Plot Essence 20 - Free Action - This armor contains 20 charges. Instead of using PP, you may spend up to 3 charges and restore the same amount of PP to yourself","Crashing Waves - Bonus Action - Until the end of your next turn, ignore all damage taken. All damage mitigated this way is taken at the end of your next turn"
326,Armor,Bright Yellow Poncho,,3,Horror,Armor Threshold 5,"""The rain was pouring down hard, but out in the middle of the street I saw a figure. I couldn't see them closely under that poncho they were wearing, but they sure gave me the heebie-jeebies. Something was up, and I didn't want to stick around to find out the details.""",,,,Shadowed Face - Your appearance doesn't give away your identity,"Bloody Poncho - Free Action, 3PP - After you defeat an enemy, gain Fury and Unstoppable for the rest of combat, and your next attack inflicts Fear","Mad Rush - Bonus Action - Until the end of this round, your speed and damage is doubled, your attacks inflict Fear, and you do not provoke reactions"
331,Armor,Martial Arts Gi,,2,Sports,Armor Threshold 4,"If you aren't wearing one of these, how will people know that you're a martial artist? Sometimes fighters will tear off the sleeves, or refrain from wearing the top.",,,,"Combo Hit -  When you make a melee attack, you can choose to instead attack twice, rolling half the dice, rounding down","Grappler - Bonus Action, 2PP - Grapple a target in melee range",Close Combat - Action - Make 3 Melee attacks
332,Armor,Animated Armor,,2,Horror,Armor Threshold 4,"Initially it looks like a normal set of armor, but it bears a terrible mundane curse: Life. But don't get too attached to it, agent. Remember, it's a tool, not a person.",,,,"Self-Propelled Shell - As an action, you can don or doff the armo. While doffed, it grants you a Threshold of 2. It takes its turn immediately after you, and it can move using your move speed, and attacks with a Str of 4 and 1 Damage.","Iron Maiden - Free Action, 2PP - If the armor is adjacent to a creature of its size class or smaller, it attempts to grapple it, with a Str of 4","Fragment - Action - Melee Radius 3 attack centered on the armor, add 2d6 and Wound 2"
333,Armor,Deranged Knight's Plate,,2,Horror,Armor Threshold 4,"Who is the one cursed, the armor, or the one wearing it? It's probably the armor, anyone wearing it has succumbed to madness, as unstoppable and destructive as a derailed train.",,,,"Maddening Strength - While you're affected by Madness, Malfunctioning, or Wound, attacks against you have TI1 and you gain DR 4","Beserker's Curse - Action, 2PP - Until the end of your next turn, gain Malfunctioning",Combat Rush- Bonus Action -  If under the effect of Maddening Strength: Attacks this turn gain +2 Damage and Inflict Malfunctioning
334,Armor,Football Pads,,1,Sports,Armor Threshold 3,Standard protective for playing the most American of sports,,,,Gridlock - Allies gain TR1 against targets you have grappled,"Tackle  - Action, 1PP - Move up to your move speed, Melee Str + number of spaces moved, Grapples on hit",Unstoppable Charge - gain Unstoppable until the end of combat
